ENVO_01000557,liquefied natural gas,,,"Liquefied natural gas (LNG) is natural gas (predominantly methane, CH4) that has been converted to liquid form for ease of storage or transport. It takes up about 1/600th the volume of natural gas in the gaseous state. It is odorless, colorless, non-toxic and non-corrosive. LNG achieves a higher reduction in volume than compressed natural gas (CNG) so that the (volumetric) energy density of LNG is 2.4 times greater than that of CNG or 60 percent of that of diesel fuel.",,,liquified natural gas; LNG,,,,,ENVO_01000558,,fuel|increased pressure|pressure|combustibility|condensed,,,,,,,,fuel|increased pressure|pressure|combustibility|condensed,,,,,increased pressure|pressure|condensed,fuel,liquefied hydrocarbon gas|liquefied natural gas,,,,,,,,,
ENVO_01000558,liquefied hydrocarbon gas,,,,,,,,,,envoPolar,ENVO_01000815; ENVO_2000045,,fuel|increased pressure|pressure|combustibility|condensed,,,,,,,,fuel|increased pressure|pressure|combustibility|condensed,,,,,increased pressure|pressure|condensed,fuel,liquefied hydrocarbon gas,,,,,,,,,
ENVO_01000559,compressed biogas,,"This is distinct from compressed natural gas, which refers to the compressed form of a fossil fuel.",Compressed biogas is biogas stored at increased pressures.,,,,,,,,ENVO_01000556,,fuel|increased pressure|pressure|combustibility,,,,,,,,fuel|increased pressure|pressure|combustibility,,,,carbon oxide|carbon dioxide|alkane|methane|aliphatic compound,increased pressure|pressure,fuel,biogas|compressed biogas|hydrocarbon gas,,carbon oxide|carbon dioxide|alkane|methane|aliphatic compound,,carbon oxide|carbon dioxide|alkane|methane|aliphatic compound,,,,,
ENVO_01000560,charcoal,,,"Charcoal is a light, black residue, consisting of carbon and any remaining ash, obtained by removing water and other volatile constituents from animal and vegetation substances. Charcoal is usually produced by slow pyrolysis, the heating of wood or other substances in the absence of oxygen.",,,,,,,,ENVO_01000814; ENVO_01000155; ENVO_2000045,,fuel|combustibility,,,,,,,aerosol formation process|thermolysis|pyrolysis,fuel|combustibility,,,,,,fuel,charcoal,,,aerosol formation process|thermolysis|pyrolysis,,,,aerosol formation process|thermolysis|pyrolysis,,
ENVO_01000575,wax,,,A wax is an environmental material which is primarily composed of lipids or other organic compounds that consist of long alkyl chains. Waxes are are malleable near ambient temperatures and melt at approximately 45 degrees Celsius.,,,,,,,,ENVO_00010483,,,,,,,,,,,,,,,,,wax,,,,,,,,,
ENVO_01000599,river water,,,,,,,,,,,ENVO_03605006,,,,,,,,,,,,,,,,,liquid water|river water|stream water,,hydrosphere|river|stream,,hydrosphere|river|stream,hydrosphere|river|stream,,,,
ENVO_01000600,rainwater,,,Rainwater is liquid water which has precipitated in the form of droplets through the condensation of atmospheric water vapour.,,,,,,,,ENVO_00002011,,,,,,,,,precipitation process,,,,,,,,liquid water|fresh water|rainwater,,,precipitation process,,,,precipitation process,,
ENVO_01000628,plant litter,,,"Leaf litter is dead plant material, such as leaves, bark, needles, and twigs, that has fallen to the ground.",,,duff; leaf litter; litterfall; soil litter; tree litter,,,,,CARO_0000000; ENVO_01000155,,dead|viability,,,,,,,,dead|viability,plant axis|plant organ|plant structure|collective plant structure|collective plant organ structure|shoot system|shoot axis|shoot apical meristem|shoot axis apex|peripheral zone|shoot system meristem|apical meristem|primordium|phyllome primordium|phyllome anlagen,,,plant organ|plant structure|phyllome|leaf,dead|viability,,plant litter,,plant organ|plant structure|collective plant structure|collective plant organ structure|phyllome|leaf|shoot system,,plant organ|plant structure|collective plant structure|collective plant organ structure|phyllome|leaf|shoot system,,,,,
ENVO_01000637,outer space,,,"Outer space is a hard vacuum containing a low density of particles, predominantly a plasma of hydrogen and helium as well as electromagnetic radiation, magnetic fields, neutrinos, dust and cosmic rays that exists between celestial bodies.",,space,,,,,envoAstro,ENVO_00010483,,,,,,,,,,,,,,,,,outer space,,,,,,,,,
ENVO_01000648,magma,,,"Magma is a mixture of molten or semi-molten rock, volatiles, and solids that is found beneath the uppermost solid layer of a planetary body. Besides molten rock, magma may also contain suspended crystals, dissolved gas and sometimes gas bubbles.",,,,,,,,ENVO_02000140,,increased temperature,,,,,,,,increased temperature,,,,,increased temperature,,magma,planetary structural layer,,,,,,,,
ENVO_01000660,tephra,,,"Tephra is fragmental material produced by a volcanic eruption regardless of composition, fragment size or emplacement mechanism.",,,,,,,,ENVO_01000814,,broken,,,,,,,volcanic eruption|explosive eruption,broken,,,,,broken,,tephra,,,volcanic eruption|explosive eruption,,,,volcanic eruption|explosive eruption,,
ENVO_01000661,tuff,,,Tuff is a type of rock made of volcanic ash ejected from a vent during a volcanic eruption.,,,,,,,,ENVO_00001995,,hard,,,,,,,volcanic eruption,hard,,,,,hard,,rock|tuff,,,volcanic eruption,,,,volcanic eruption,,
ENVO_01000662,scoria,,"Scoria differs from pumice in having larger vesicles, thicker vesicle walls and being dark colored and denser.","Scoria is a highly vesicular, dark colored volcanic rock that may or may not contain crystals.",,,cinder,,,,,ENVO_00001995,,hard,,,,,,,volcanic eruption,hard,,,,,hard,,rock|scoria,,,volcanic eruption,,,,volcanic eruption,,
ENVO_01000663,pumice,,"Scoria differs from pumice in having larger vesicles, thicker vesicle walls and being dark colored and denser.","Pumice is a volcanic rock that consists of highly vesicular rough textured volcanic glass, which may or may not contain crystals.",,,,,,,,ENVO_00001995,,hard,,,,,,,volcanic eruption,hard,,,,,hard,,rock|pumice,,,volcanic eruption,,,,volcanic eruption,,
ENVO_01000676,contaminated air,,,Contaminated air is air which has sufficient concentrations of environmental pollutants such that it may adversely affect a given ecosystem.,,,,,,,,ENVO_00002005,,,dinitrogen|diatomic nitrogen,,,,,,,,,,,dinitrogen|dioxygen|carbon oxide|carbon dioxide|diatomic oxygen|argon molecular entity|water vapour|diatomic nitrogen,,,air|contaminated air,,dioxygen|carbon oxide|carbon dioxide|dinitrogen|argon molecular entity|water vapour|diatomic nitrogen|diatomic oxygen,,dinitrogen|dioxygen|carbon oxide|carbon dioxide|diatomic oxygen|argon molecular entity|water vapour|diatomic nitrogen,,,,,
ENVO_01000681,sodium chloride salt,,,A mineral material composed primarily of sodium chloride.,"This class is for material primarily composed of sodium chloride. For other pure chemical salts, consider a CHEBI class. Request new ENVO terms for environmental samples of other chemical salts.",salt,,,,,envoPolar,ENVO_01000508,,,salt|sodium chloride|chlorine molecular entity,,,,,,,,,,,salt|halogen|chlorine molecular entity|chlorine atom|sodium chloride|chloride,,,salt material|sodium chloride salt,,salt|halogen|sodium chloride|chlorine molecular entity|chloride|chlorine atom,,salt|chlorine molecular entity|sodium chloride|chloride|chlorine atom|halogen,,,,,
ENVO_01000701,volcanic ash,,,"Volcanic ash is an environmental material which consists of fragments of pulverized rock, minerals, and volcanic glass, created during volcanic eruptions and measuring less than 2 millimetres in diameter. Volcanic ash is formed during explosive volcanic eruptions, phreatomagmatic eruptions and during transport in pyroclastic density currents.",,,,,,,,ENVO_02000090,,,silicon molecular entity|silicon dioxide,,,,,,aerosol formation process|thermolysis|volcanic eruption|combustion process,,,,,silicon molecular entity|silicon dioxide,,,ash|volcanic ash,,silicon molecular entity|silicon dioxide,aerosol formation process|volcanic eruption|combustion process|thermolysis,silicon molecular entity|silicon dioxide,,,aerosol formation process|thermolysis|volcanic eruption|combustion process,,
ENVO_01000722,meltwater,,,"Meltwater is the water released by the melting of snow or ice, including glacial ice, tabular icebergs and ice shelves over oceans.",,,,,,,,ENVO_00002006,,,,,,,,hydrological melting process|melting,hydrological melting process|melting,,,,,,,,liquid water|meltwater,,,hydrological melting process|melting,,,,hydrological melting process|melting,,
ENVO_01000751,bedrock,,,A lithified mass of rock that lies under the loose softer material (regolith) at the surface of the Earth or other terrestrial planet.,,,,,,,,ENVO_00001995,,hard,,,,,,,,hard,,,,,hard,,rock|bedrock,,,,,,,,,
ENVO_01000770,carbon dioxide emission,,This is a working definition for #280. Which processes will ultimately be included in the axioms is still open.,A volume of carbon dioxide gas emitted by a carbon dioxide emission process.,,,,,,,,ENVO_01000451,,,carbon oxide|carbon dioxide,,,,,,gas emission process|carbon dioxide emission process|hydrocarbon gas emission process,,,,,carbon oxide|carbon dioxide,,,atmospheric carbon dioxide|carbon dioxide emission,,atmosphere|fluid layer|carbon oxide|carbon dioxide,gas emission process|carbon dioxide emission process|hydrocarbon gas emission process,atmosphere|fluid layer|carbon oxide|carbon dioxide,atmosphere|fluid layer,,gas emission process|hydrocarbon gas emission process|carbon dioxide emission process,,
ENVO_01000789,flame,,,"A portion of gas which is emitted by a fire or other exothermic reaction, is of increased temperature, and typically emits light in the visible range.",,,,,,,,ENVO_01000797,,increased temperature,,,,,,,,increased temperature,,,,,increased temperature,,flame,,,,,,,,,
ENVO_01000790,hydrocarbon flame,,,A flame which is produced by the combustion of hydrocarbon fuel.,,,,,,,,ENVO_01000789,,increased temperature,dioxygen|carbon oxide|carbon dioxide|dinitrogen|water vapour|diatomic nitrogen|diatomic oxygen,,,,,,aerosol formation process|thermolysis|combustion process,increased temperature,,,,dinitrogen|dioxygen|carbon oxide|carbon dioxide|diatomic oxygen|water vapour|diatomic nitrogen,increased temperature,,flame|hydrocarbon flame,,dioxygen|carbon oxide|carbon dioxide|dinitrogen|water vapour|diatomic nitrogen|diatomic oxygen,aerosol formation process|combustion process|thermolysis,dinitrogen|dioxygen|carbon oxide|carbon dioxide|diatomic oxygen|water vapour|diatomic nitrogen,,,aerosol formation process|thermolysis|combustion process,,
ENVO_01000797,gaseous environmental material,,,A material entity which is composed of one or more chemical entities and has neither independent shape nor volume but tends to expand indefinitely.,This class is to be populated by inference.,,,gas,,,,ENVO_02000140,,,,,,,,,,,,,,,,,,,,,,,,,,
ENVO_01000798,plasma,,,"A material entity which is composed of a volume of unbound positive and negative particles in roughly equal numbers, conducts electricity, and possesses internal magnetic fields.",An NTR for `quality of a plasma` has been posted on the PATO tracker: https://github.com/pato-ontology/pato/issues/88,,,,,,,ENVO_02000140,,,,,,,,,,,,,,,,,plasma,,,,,,,,,
ENVO_01000814,solid environmental material,,"This is a defined class: its subclasses will not be asserted, but filled by inference.",An environmental material which is in a solid state.,,,,,,,,ENVO_00010483,,,,,,,,,,,,,,,,,,,,,,,,,,
ENVO_01000815,liquid environmental material,,"This is a defined class: most of its subclasses will not be asserted, but filled by inference.",An environmental material which is in a liquid state.,,,,,,,envoPolar,ENVO_02000140,,,,,,,,,,,,,,,,,,,,,,,,,,
ENVO_01000828,humid air,,,Air which has increased levels of water vapour.,,,,,,,,ENVO_00002005,,humidity|increased humidity,dinitrogen|diatomic nitrogen,,,,,,,humidity|increased humidity,,,water vapour,dinitrogen|dioxygen|carbon oxide|carbon dioxide|diatomic oxygen|argon molecular entity|water vapour|diatomic nitrogen,humidity|increased humidity,,air|humid air,,dioxygen|carbon oxide|carbon dioxide|dinitrogen|argon molecular entity|water vapour|diatomic nitrogen|diatomic oxygen,,dinitrogen|dioxygen|carbon oxide|carbon dioxide|diatomic oxygen|argon molecular entity|water vapour|diatomic nitrogen,,,,,
ENVO_01000829,water vapour saturated air,,"""Near equal"" is meant to reflect that there will be fluctuations around the equilibrium point.",Air which has a partial pressure of water vapour equal or near equal to its equilibrium vapor pressure at a given temperature.,,,water-vapour-saturated air,,wet air,,,ENVO_01000828,,humidity|increased humidity,dinitrogen|diatomic nitrogen,,,,,,,humidity|increased humidity,,,water vapour,dinitrogen|dioxygen|carbon oxide|carbon dioxide|diatomic oxygen|argon molecular entity|water vapour|diatomic nitrogen,humidity|increased humidity,,air|water vapour saturated air|humid air,,dioxygen|carbon oxide|carbon dioxide|dinitrogen|argon molecular entity|water vapour|diatomic nitrogen|diatomic oxygen,,dinitrogen|dioxygen|carbon oxide|carbon dioxide|diatomic oxygen|argon molecular entity|water vapour|diatomic nitrogen,,,,,
ENVO_01000838,smoke,,"Smoke is a collection of airborne solid and liquid particulates and gases emitted when a material undergoes combustion or pyrolysis, together with the quantity of gas that is entrained or otherwise mixed into the mass",,,,,,,,,ENVO_00010505,,amorphous,,,,,,aerosol formation process|combustion process|thermolysis,aerosol formation process|thermolysis|combustion process,amorphous,,,,,amorphous,,aerosol|smoke,,,aerosol formation process|combustion process|thermolysis,,,,aerosol formation process|thermolysis|combustion process,,
ENVO_01000842,smog,,,A fog which is intermixed with smoke or other combustion products and their derivatives.,,,,,,,,ENVO_01000844,air,amorphous|chemical role|environmental contaminant,liquid water|atmospheric aerosol|aerosol|smoke|fog|aerosolised liquids,,,,,,condensation process,amorphous|chemical role|environmental contaminant,,,,liquid water|atmospheric aerosol|aerosol|smoke|fog|aerosolised liquids,amorphous,chemical role|environmental contaminant,atmospheric aerosol|aerosol|fog|aerosolised liquids|smog,atmosphere|fluid layer,atmosphere|fluid layer|liquid water|air|atmospheric aerosol|aerosol|smoke|fog|aerosolised liquids,condensation process,atmosphere|fluid layer|liquid water|atmospheric aerosol|aerosol|smoke|fog|aerosolised liquids,atmosphere|fluid layer,,condensation process,,air
ENVO_01000844,fog,,"Fog is more opaque than mist, reducing visibility to under one kilometre. This class refers only to fog formed by materials primarily composed of water. ""Fog can be considered a type of low-lying cloud and is heavily influenced by nearby bodies of water, topography, and wind conditions. In turn, fog has affected many human activities, such as shipping, travel, and warfare."" https://en.wikipedia.org/wiki/Fog",A visible mass of cloud water droplets or ice crystals suspended in the air at or near the surface of an astronomical body.,,,,,haar,,envoCryo,ENVO_01001088; ENVO_01001652,air,amorphous,liquid water,,,,,,condensation process,amorphous,,,,liquid water,amorphous,,atmospheric aerosol|aerosol|fog|aerosolised liquids,atmosphere|fluid layer,atmosphere|fluid layer|liquid water|air,condensation process,atmosphere|fluid layer|liquid water,atmosphere|fluid layer,,condensation process,,air
ENVO_01000845,crystal,,This class refers to a portion of crystal and not an individual crystal.,"A solid material whose constituents, such as atoms, molecules or ions, are arranged in a highly ordered microscopic structure, forming a crystal lattice that extends in all directions.",,,,,,,,ENVO_01000814,,,,,,,,,,,,,,,,,,,,,,,,,,
ENVO_01000846,water ice crystal,,"Any one of a number of macroscopic, crystalline forms in which ice appears, including hexagonal columns, hexagonal platelets, dendritic crystals, ice needles, and combinations of these forms.  The crystal lattice of ice is hexagonal in its symmetry under most atmospheric conditions.",A crystal which is primarily composed of water ice.,,ice crystal,,,,,envoPolar,ENVO_01000845,,,ice|water ice,,,,,,,,,,,water ice|ice,,,water ice crystal,,ice|water ice,,water ice|ice,,,,,
ENVO_01000847,hair ice,,,"A type of water ice that forms on dead wood with the assistance of the fungus Exidiopsis effusa and takes the shape of fine, silky hair.",Add quality like filamentous from PATO,,frost beard; ice wool,,,,envoPolar,ENVO_01000277,,,,,,,,,,,,,,,,,water ice|ice|hair ice,terrestrial biome|terrestrial ecosystem|forest biome|broadleaf forest biome|broadleaf forest|forest ecosystem,,,,,,,,
ENVO_01000850,clathrate material,,"This class is not to be confused with CHEBI's ""clathrate"". The latter refers to the pure substance, while this class refers to clathrates found in nature.
""Traditionally, clathrate compounds are polymeric and completely envelop the guest molecule, but in modern usage clathrates also include host-guest complexes and inclusion compounds."" https://en.wikipedia.org/wiki/Clathrate_compound",A material which is primarily composed of a substance arranged as a lattice which can trap or contain other molecules.,"Not sure if this should be a subclass of crystal. If it is removed, remember to assert that it is a solid.",,clathrate compound material; clathrate crystal material,,,,envoPolar,ENVO_01000845,,,,,,,,,,,,,,,,,clathrate material,,,,,,,,,
ENVO_01000851,methane clathrate,,,"A clathrate material in which a large amount of methane is trapped within a crystal structure of water, forming a solid similar to ice.",,,fire ice; gas hydrate; hydromethane; methane hydrate; methane ice; natural gas hydrate,,,,envoPolar,ENVO_01000850,,,,,,,,,,,,,,,,,clathrate material|methane clathrate,,,,,,,,,
ENVO_01000853,marl,,,Marl is a mass of calcium carbonate derived from mollusk shells and mixed with silt and clay.,A request from the Agronomy Ontology in Issue #345.,,,,,,,ENVO_01000256,,,salt|calcium carbonate|calcium molecular entity|carbonates|carbonate salt|alkaline earth salt,,,,,,,,,,,clay|silt|salt|calcium carbonate|calcium molecular entity|carbonate|carbonates|alkaline earth cation|carbonate salt|divalent metal cation|alkaline earth salt|divalent inorganic cation,,,marl,,clay|silt|salt|calcium carbonate|calcium molecular entity|carbonate|carbonates|alkaline earth cation|carbonate salt|divalent metal cation|divalent inorganic cation|alkaline earth salt,,clay|silt|calcium carbonate|calcium molecular entity|salt|carbonate|carbonates|alkaline earth cation|carbonate salt|divalent metal cation|divalent inorganic cation|alkaline earth salt,,,,,
ENVO_01000872,ballast water,,"This definition could be improved, as ballast water is often used in more general ways, beyond the water contained in a ballast tank at any given time. For example, water which has just been released from a ballast tank is often still refered to as ballast water.",Ballast water is water contained in the ballast tanks of sea-going vessels.,,,,,,,,ENVO_00002006,,,,,,,,,,,,,,,,,liquid water|ballast water,manufactured product|ballast tank,,,,,,,,
ENVO_01000939,time crystal,,"While the usage of the term is still debated, the general idea is that time crystals (which have been made using ytterbium ions and defect-bearing diamonds) break temporal symmetry analogously to how mineral crystal break spatial symmetry. While spatial crystals are inhomogeneous in space (vs a gas, which is distributed evenly) due to the ordering of their atoms, the properties of atoms in a time crystal are inhomogeneous in the time dimension.",An open system in non-equilibrium with its environment that exhibits time translation symmetry breaking.,,,space-time crystal,,,,,ENVO_00010483,,,,,,,,,,,,,,,,,time crystal,,,,,,,,,
ENVO_01000940,fissure water,,"While containment is often enough to classify this subtype of water, it is expected that the water's composition is altered by contact with the solid material bounding the fissure's site.",Water which is partially contained within a fissure or a geological fracture.,The axiomatisation should be more tuned to the site within the fissure.,,fracture water,,,,,ENVO_00002006,,,,,,,,,,,,,,,,,liquid water|fissure water,,,,,,geological fracture,,,
ENVO_01000962,diatomite,,"This material is easily crumbled into a fine white to off-white powder. The powder has a particle size ranging from less than 3 micrometres to more than 1 millimetre, but typically 10 to 200 micrometres. The diatoms in each deposit contain different amounts of silica, depending on the age of the deposit. The species of diatom may differ among deposits. The species of diatom is dependent upon the age and paleo-environment of the deposit. In turn, the shape of a diatom is determined by its species. The typical chemical composition of oven-dried diatomaceous earth is 80 to 90% silica, with 2 to 4% alumina (attributed mostly to clay minerals) and 0.5 to 2% iron oxide.","A sedimentary rock which is primarily composed of the fossilized, siliceous remains of diatoms mixed with varying amounts of other clays and minerals.",,,kieselguhr; kieselgur,,diatomaceous earth; D.E.,,,ENVO_00002016,,hard,,,,,,,,hard,,,,aluminium molecular entity|silicon molecular entity|silicon dioxide|iron molecular entity|iron oxide|aluminium oxides|aluminium oxide,hard,,rock|sedimentary rock,,aluminium molecular entity|silicon molecular entity|silicon dioxide|iron molecular entity|iron oxide|aluminium oxides|aluminium oxide,,silicon molecular entity|silicon dioxide|aluminium molecular entity|iron molecular entity|iron oxide|aluminium oxides|aluminium oxide,,,,,
ENVO_01000964,industrial wastewater,,,Wastewater which is produced by industrial activity and which contains chemical contaminants other than those associated with urine and fecal matter.,,,,,,,,ENVO_00002001,,waste role,,,,,,,,waste role,,,,,,waste role,liquid water|waste material|industrial wastewater|waste water|contaminated water,,,,,,,,,
ENVO_01001004,groundwater,,"The definition of aquifer is quite permissive, referencing any water bearing rock or unconsolidated material.","Underground water which is located in pore spaces found in rock or unconsolidated deposits such as soil, clay, or gravel.",,,ground water,,,,,ENVO_00005792,,,,,,,,,,,,,,,,,liquid water|groundwater|underground water,aquifer,,,,,,,,
ENVO_01001018,hypereutrophic water,,The thresholds of eutrophy are fluid and often locally defined.,Water which has a very high concentration of nutrients.,,,,,,,,ENVO_00002224,,,,,,,,,,,,,,,,,liquid water|hypereutrophic water|eutrophic water,,,,,,,,,
ENVO_01001028,sediment permeated by freshwater,,"We do not specify numeric thresholds for saline vs. non-saline here, as this is variable. Consider specifying this on the information and/or data layer for your purposes. If you require an ENVO class with a fixed threshold, please request one using our issue tracker.",Sediment which has its porespace filled by water which has very low levels of sodium chloride and/or other salts.,,,,,,,envoEmpo; envoOmics,ENVO_00002007,liquid water|fresh water,porous|porosity|granular,,,,,,,,porous|porosity|granular,,,,,porous|porosity|granular,,sediment|sediment permeated by freshwater,,liquid water|fresh water,,,,,,,liquid water|fresh water
ENVO_01001036,sediment permeated by saline water,,"We do not specify numeric thresholds for saline vs. non-saline here, as this is variable. Consider specifying this on the information and/or data layer for your purposes. If you require an ENVO class with a fixed threshold, please request one using our issue tracker.",Sediment which has its porespace filled by water with increased levels of sodium chloride and other salts.,,,,,,,envoEmpo; envoOmics,ENVO_00002007,liquid water|saline water,porous|porosity|granular,,,,,,,,porous|porosity|granular,,,,,porous|porosity|granular,,sediment|sediment permeated by saline water,,liquid water|saline water,,,,,,,liquid water|saline water
ENVO_01001037,slightly saline water,,"The United States Geological Survey classifies slightly saline water as having around 1,000 to 3,000 ppm (0.1–0.3%) of dissolved salts.","Water which contains a slightly increased concentration of dissolved salts, relative to their concentration in freshwater.",,,slightly salty water,,,,,ENVO_00002010,,osmolarity|increased osmolarity,,,,,,,,osmolarity|increased osmolarity,,,salt|chlorine molecular entity|sodium chloride,halogen|chlorine molecular entity|salt|chlorine atom|sodium chloride|chloride,osmolarity|increased osmolarity,,liquid water|saline water|slightly saline water,,salt|halogen|sodium chloride|chlorine molecular entity|chloride|chlorine atom,,halogen|salt|sodium chloride|chlorine molecular entity|chloride|chlorine atom,,,,,
ENVO_01001038,moderately saline water,,"The United States Geological Survey classifies moderately saline water as having around 3,000 to 10,000 ppm (0.3–1%) of dissolved salts.","Water which contains a moderately increased concentration of dissolved salts, relative to their concentration in freshwater.",,,moderately salty water,,,,,ENVO_00002010,,osmolarity|increased osmolarity,,,,,,,,osmolarity|increased osmolarity,,,salt|chlorine molecular entity|sodium chloride,halogen|chlorine molecular entity|salt|chlorine atom|sodium chloride|chloride,osmolarity|increased osmolarity,,liquid water|saline water|moderately saline water,,salt|halogen|sodium chloride|chlorine molecular entity|chloride|chlorine atom,,halogen|salt|sodium chloride|chlorine molecular entity|chloride|chlorine atom,,,,,
