class,labels,alternative_terms,comments,definitions,editor_notes,has_broad_synonyms,has_exact_synonyms,has_narrow_synonyms,has_related_synonyms,hasSynonyms,in_subsets,superclasses,adjacent to,bearer of,composed primarily of,contained in,derives from,derives into,existence starts during or after,formed as result of,functionally related to,has characteristic,has developmental contribution from,has function,has increased levels of,has part,has quality,has role,http://www.w3.org/2000/01/rdf-schema#subClassOf,located in,mereotopologically related to,output of,overlaps,part of,partially surrounded by,participates in,relation between physical entity and a process or stage,surrounded by
ENVO_00000003,mine tailing,,,Mine tailings are the materials left over after the process of separating the valuable fraction from the uneconomic fraction (gangue) of an ore.,,tailing,,,,,,ENVO_0010001,,,,,,,,,anthropogenic environmental process,,,,,,,,mine tailing,,,anthropogenic environmental process,,,,anthropogenic environmental process,,
ENVO_00000134,permafrost,,"Ice is not always present, as may be in the case of nonporous bedrock, but it frequently occurs and it may be in amounts exceeding the potential hydraulic saturation of the ground material.",An environmental material which is 1) composed primarily of soil or rock and included ice or organic material and 2) at or below the freezing point of water for two or more years.,,,,,,,envoPolar,ENVO_00010483,,decreased temperature|decreased quality,,,,,,,,decreased temperature|decreased quality,,,,,decreased temperature|decreased quality,,permafrost,,,,,,,,,
ENVO_00000194,scree,,,"Broken rock that appears at the bottom of crags, mountain cliffs or valley shoulders.",,,,,TALUS; talus slope,,,ENVO_01000814,,,,,rock,,,,,,,,,piece of rock|rock,,,scree,,piece of rock|rock,,piece of rock|rock,,,,,
ENVO_00000338,vomit material,,"ENVO bodily fluid classes differ from UBERON's treatment of bodily fluids. UBERON refers to the substance itself (""S""). We assert that UBERON's classes are the primary compositional component of the terms in ENVO (""S material""). Use of the ENVO terms is typically recommended when you wish to indicate that there may be other materials intermixed with S.","A bodily fluid material which is composed primarily of vomit, a bodily fluid consisting of the expulsed contents of the stomach of an organism disgorged through the mouth or nose.",,,,,,,,ENVO_02000019,,,sweat|cerumen|vomit|regurgitated substance,,,,,,,,,,,sweat|cerumen|vomit|regurgitated substance,,,bodily fluid material|vomit material,,sweat|cerumen|vomit|regurgitated substance,,sweat|cerumen|vomit|regurgitated substance,,,,,
ENVO_00000546,lake sediment,,,"Lake sediment is sediment which covers the bottom of a lake. Lake sediments are comprised mainly of clastic material (sediment of clay, silt, and sand sizes), organic debris, chemical precipitates, or combinations of these.",,,,,SedimentLayer,,,ENVO_00002007,lake,porous|porosity|granular,,,,,,,sedimentation in a water body|material accumulation process,porous|porosity|granular,,,,,porous|porosity|granular,,sediment|lake sediment,,lake,sedimentation in a water body|material accumulation process,,,,sedimentation in a water body|material accumulation process,,
ENVO_00001995,rock,,"From https://en.wikipedia.org/wiki/ [A mineral] is different from a rock, which can be an aggregate of minerals or non-minerals and does not have a specific chemical composition. The exact definition of a mineral is under debate, especially with respect to the requirement a valid species be abiogenic, and to a lesser extent with regards to it having an ordered atomic structure.",A rock is a naturally occurring solid aggregate of one or more minerals or mineraloids.,,,,,,,,ENVO_01000814,,hard,,,,,,,,hard,,,,,hard,,rock,,,,,,,,,
ENVO_00001998,soil,,"'In engineering terms, soil is referred to as regolith, or loose rock material that lies above the 'solid geology'. Soil is commonly referred to as ""earth"" or ""dirt""; technically, the term ""dirt"" should be restricted to displaced soil.' https://en.wikipedia.org/wiki/Soil

"" The upper limit of soil is the boundary between soil and air, shallow water, live plants, or plant materials that have not begun to decompose. Areas are not considered to have soil if the surface is permanently covered by water too deep (typically more than 2.5 meters) for the growth of rooted plants.

The lower boundary that separates soil from the nonsoil underneath is most difficult to define. Soil consists of horizons near the Earth's surface that, in contrast to the underlying parent material, have been altered by the interactions of climate, relief, and living organisms over time. Commonly, soil grades at its lower boundary to hard rock or to earthy materials virtually devoid of animals, roots, or other marks of biological activity. For purposes of classification, the lower boundary of soil is arbitrarily set at 200 cm.""  Soil taxonomy, 2nd Ed., quoted in http://www.nrcs.usda.gov/wps/portal/nrcs/detail/soils/edu/?cid=nrcs142p2_054280","An environmental material which is primarily composed of minerals, varying proportions of sand, silt, and clay, organic material such as humus, interstitial gases, liquids, and a broad range of resident micro- and macroorganisms.","The various 'has part' and 'has quality' relations may not hold true for all soils; however, I have yet to find counter examples. Require input from a pedologist or similar. [pbuttigieg]",regolith,,,,,http://purl.obolibrary.org/obo/envo#EnvO-Lite-GSC,ENVO_01000813; ENVO_00010483,,porous|porosity,,,,,,,,porous|porosity,,,,clay|sand|silt,porous|porosity,,soil,,pedosphere|sand|clay|silt,,pedosphere|clay|sand|silt,pedosphere,,,,
ENVO_00002001,waste water,,,Water that has been adversely affected in quality by anthropogenic influence.,,,,,,,http://purl.obolibrary.org/obo/envo#EnvO-Lite-GSC,ENVO_00002186; ENVO_00002264,,waste role,,,,,,,,waste role,,,,,,waste role,liquid water|waste material|waste water|contaminated water,,,,,,,,,
ENVO_00002003,fecal material,,"ENVO bodily fluid classes differ from UBERON's treatment of bodily fluids. UBERON refers to the substance itself (""S""). We assert that UBERON's classes are the primary compositional component of the terms in ENVO (""S material""). Use of the ENVO terms is typically recommended when you wish to indicate that there may be other materials intermixed with S.; This is distinct from classes such as http://purl.obolibrary.org/obo/UBERON_0001988 in that it refers to the environmental material composed primarily of feces rather than 'just' feces.","An excreta material which is composed primarily of feces, an excreta consisting of waste products expelled from an animal's digestive tract through the anus (or cloaca) during defecation.",,,faeces material; feces material,,droppings; frass; pellet,,,ENVO_02000022,,waste role,sweat|excreta|feces|cerumen,,,,,,,waste role,,,,sweat|feces|cerumen|excreta,,waste role,waste material|fecal material|bodily fluid material|excreta material,,sweat|excreta|feces|cerumen,,sweat|excreta|feces|cerumen,,,,,
ENVO_00002005,air,,,"The mixture of gases (roughly (by molar content/volume: 78% nitrogen, 20.95% oxygen, 0.93% argon, 0.038% carbon dioxide, trace amounts of other gases, and a variable amount (average around 1%) of water vapor) that surrounds the planet Earth.",,,,,,,http://purl.obolibrary.org/obo/envo#EnvO-Lite-GSC; envoPolar,ENVO_01000797,,,dinitrogen|diatomic nitrogen,,,,,,,,,,,dinitrogen|dioxygen|carbon oxide|carbon dioxide|diatomic oxygen|argon molecular entity|water vapour|diatomic nitrogen,,,air,,dioxygen|carbon oxide|carbon dioxide|dinitrogen|argon molecular entity|water vapour|diatomic nitrogen|diatomic oxygen,,dinitrogen|carbon dioxide|diatomic oxygen|argon molecular entity|dioxygen|carbon oxide|water vapour|diatomic nitrogen,,,,,
ENVO_00002006,liquid water,,,An environmental material primarily composed of dihydrogen oxide in its liquid form.,,water,,,,,,ENVO_01000815,,,,,,,,,,,,,,,,,liquid water,,,,,,,,,
ENVO_00002007,sediment,,Sediment is typically deposited on the bed or bottom of a body of water or other liquid.,Particulate environmental material which is formed as a result of the transport and deposition of particles by flowing liquid.,,,,,,,http://purl.obolibrary.org/obo/envo#EnvO-Lite-GSC; envoPolar,ENVO_01000060,,porous|porosity|granular,,,,,,,,porous|porosity|granular,,,,,porous|porosity|granular,,sediment,,,,,,,,,
ENVO_00002008,dust,,Dust occurs in and may be deposited from the atmosphere.,Particulate environmental material with diameters less than 500 micrometers.,Do not oversimplify the particulate environmental material subclasses with design patterns or similar. The materials have properties that their components do not - write full definitions including these where possible.,,,,,,envoPolar,ENVO_01000814; ENVO_01000060,,dry|granular,,,,,,,,dry|granular,,,,,dry|granular,,dust,,,,,,,,,
ENVO_00002010,saline water,,"The threshold salt concentration for classifying water as saline varies, but typically begins at about 1,000 to 3,000 parts salt per million parts water or 0.1–0.3% salt by weight.",Water which contains a significant concentration of dissolved salts.,,,salt water,,,,,ENVO_00002006,,osmolarity|increased osmolarity,,,,,,,,osmolarity|increased osmolarity,,,salt|chlorine molecular entity|sodium chloride,salt|halogen|chlorine molecular entity|chlorine atom|sodium chloride|chloride,osmolarity|increased osmolarity,,liquid water|saline water,,salt|halogen|sodium chloride|chlorine molecular entity|chloride|chlorine atom,,salt|chlorine molecular entity|sodium chloride|chloride|chlorine atom|halogen,,,,,
ENVO_00002011,fresh water,,"The lower bound of solute concentration required for water to be considered freshwater is variable, but is always less than that of seawater, and often cited as less than 1 gram of solutes per 1 litre of water.","Water which has a low concentration of dissolved solutes, particularly that of sodium chloride.",,,freshwater,,sweet water,,envoEmpo; envoPolar,ENVO_00002006,,,,,,,,,,,,,,,,,liquid water|fresh water,,,,,,,,,
ENVO_00002012,hypersaline water,,"The average salinity of sea water is assumed to be around 35,000 ppm, equivalent to 35 grams of salt per one liter (or kilogram) of water.","Water which contains a highly increased concentration of dissolved salts, surpassing the average salinity of seawater.","We make no commitment to a particular threshold; this should be described on the data/information layer according to the norms of a discipline, accepted standard, or similar reference.",,,,,,envoPolar,ENVO_00002010,,osmolarity|increased osmolarity,,,,,,,,osmolarity|increased osmolarity,,,salt|chlorine molecular entity|sodium chloride,salt|halogen|chlorine molecular entity|chlorine atom|sodium chloride|chloride,osmolarity|increased osmolarity,,liquid water|saline water|hypersaline water,,salt|halogen|sodium chloride|chlorine molecular entity|chloride|chlorine atom,,salt|chlorine molecular entity|sodium chloride|chloride|chlorine atom|halogen,,,,,
ENVO_00002013,igneous rock,,,Rock formed from molten magma.,,,,,,,,ENVO_00001995,,hard,,,lava,,,,,hard,,,,,hard,,rock|igneous rock,,,,,,,,,
ENVO_00002014,plutonic rock,,,An igneous rock that results from the crystallization of a magma below the surface of the Earth.,,,,,intrusive rock,,,ENVO_00002013,,hard,,,lava,,,,,hard,,,,,hard,,rock|plutonic rock|igneous rock,,,,,,,,,
ENVO_00002015,volcanic rock,,"Due to the general suggestion that volcanic rock simply comes from a volcanic process, it's not immediately clear whether this is interchangeable with igneous rock.",An igneous rock that results from magma reaching the surface either as lava or fragmental ejecta.,,,,,,,,ENVO_00001995,,hard,,,,,,volcanic eruption,volcanic eruption,hard,,,,,hard,,rock|volcanic rock,,,volcanic eruption,,,,volcanic eruption,,
ENVO_00002016,sedimentary rock,,,"A rock formed by deposition of either clastic sediments, organic matter, or chemical precipitates (evaporites), followed by compaction of the particulate matter and cementation during diagenesis.",,,,,,,,ENVO_00001995,,hard,,,,,,,,hard,,,,,hard,,rock|sedimentary rock,,,,,,,,,
ENVO_00002017,metamorphic rock,,,A rock formed by subjecting any rock type (including previously-formed metamorphic rock) to different temperature and pressure conditions than those in which the original rock was formed. These temperatures and pressures are always higher than those at the Earth's surface and must be sufficiently high so as to change the original minerals into other mineral types or else into other forms of the same minerals (e.g. by recrystallisation).,,,,,,,,ENVO_00001995,,hard,,,,,,,,hard,,,,,hard,,rock|metamorphic rock,,,,,,,,,
ENVO_00002018,sewage,,,"Wastewater that is contaminated with feces or urine,",,,,,,,,ENVO_00002001,,waste role,waste material|animal waste material|organic waste material,,,,,,,waste role,,,,waste material|animal waste material|organic waste material,,waste role,liquid water|waste material|waste water|sewage|contaminated water,,waste material|animal waste material|organic waste material,,waste material|animal waste material|organic waste material,,,,,
ENVO_00002019,brackish water,,,Water which has a higher salinity than fresh water but a lower salinity than marine water.,,,,,,,envoPolar,ENVO_00002010,,osmolarity|increased osmolarity,,,,,,,,osmolarity|increased osmolarity,,,salt|chlorine molecular entity|sodium chloride,salt|halogen|chlorine molecular entity|chlorine atom|sodium chloride|chloride,osmolarity|increased osmolarity,,liquid water|saline water|brackish water,,salt|halogen|sodium chloride|chlorine molecular entity|chloride|chlorine atom,,salt|chlorine molecular entity|sodium chloride|chloride|chlorine atom|halogen,,,,,
ENVO_00002040,wood,,,,,,,,,,,ENVO_01000814; ENVO_01000155,,,,,,,,,,,,,,,,,wood,,,,,,,,,
ENVO_00002042,surface water,,,Water that is found on the surface of an astronomical object.,,,,,,,,ENVO_00002006,,,,,,,,,,,,,,,,,liquid water|surface water,,fluid layer|liquid water|aquatic layer|water surface|liquid layer|liquid surface layer|fluid surface layer|fluid interface layer,,fluid layer|liquid water|aquatic layer|water surface|liquid layer|liquid surface layer|fluid surface layer|fluid interface layer,fluid layer|liquid water|aquatic layer|water surface|liquid layer|liquid surface layer|fluid surface layer|fluid interface layer,,,,
ENVO_00002044,sludge,,,"The residual semi-solid material left from domestic or industrial processes, or wastewater treatment processes.",,,,,,,http://purl.obolibrary.org/obo/envo#EnvO-Lite-GSC,ENVO_0010001,,,,,,,,,anthropogenic environmental process,,,,,,,,sludge,,,anthropogenic environmental process,,,,anthropogenic environmental process,,
ENVO_00002045,anaerobic sediment,,,Sediment characterised by the absence of oxygen.,,,anoxic sediment,,,,envoPolar,ENVO_00002007,,porous|porosity|anaerobic|sensitivity toward|sensitivity to oxygen|granular,,,,,,,,porous|porosity|anaerobic|sensitivity toward|sensitivity to oxygen|granular,,,,,porous|porosity|anaerobic|granular|sensitivity toward|sensitivity to oxygen,,sediment|anaerobic sediment,,,,,,,,,
ENVO_00002046,activated sludge,,,,,,,,,,,ENVO_00002044,,,,,,,,,anthropogenic environmental process,,,,,,,,sludge|activated sludge,,,anthropogenic environmental process,,,,anthropogenic environmental process,,
ENVO_00002047,urine material,,"ENVO bodily fluid classes differ from UBERON's treatment of bodily fluids. UBERON refers to the substance itself (""S""). We assert that UBERON's classes are the primary compositional component of the terms in ENVO (""S material""). Use of the ENVO terms is typically recommended when you wish to indicate that there may be other materials intermixed with S.","An excreta material which is composed primarily of urine, a liquid excreta containing water and waste products made by the kidneys, stored in the bladder, and leaves the body through the urethra.",,,,,,,,ENVO_02000022,,waste role,sweat|excreta|cerumen|urine,,,,,,,waste role,,,,sweat|cerumen|excreta|urine,,waste role,waste material|bodily fluid material|excreta material|urine material,,excreta|sweat|cerumen|urine,,sweat|excreta|cerumen|urine,,,,,
ENVO_00002053,limestone,,,A sedimentary rock which is composed primarily of calcium carbonate in the form of calcite or aragnoite.,"An interesting reasoning error was generated when this class had ""composed primariy of some CHEBI:calcium carbonate"". As that was a CHEBI:mineral, and minerals are disjoint from ENVO:rock, it led to an unsatisfiable class. The current axiom works around this, but this is requires some sort of geological convention to diffferentiate between masses of minerals and rocks that are composed primarily of minerals.",,,,,,,ENVO_00002016,,hard,,,salt|calcium carbonate|calcium molecular entity|carbonates|carbonate salt|alkaline earth salt,,,precipitation process,precipitation process,hard,,,,,hard,,rock|sedimentary rock|limestone,,,precipitation process,,,,precipitation process,,
ENVO_00002054,chalk,,,"Limestone which is soft, white, and porous.",,,,,,,,ENVO_00002053,,porous|porosity|hard|white|optical quality|quality of interaction of a substance with electromagnetic radiation|color,,,salt|calcium carbonate|calcium molecular entity|carbonates|carbonate salt|alkaline earth salt,,,precipitation process,precipitation process,porous|hard|porosity|quality of interaction of a substance with electromagnetic radiation|white|optical quality|color,,,,,porous|hard|porosity|quality of interaction of a substance with electromagnetic radiation|white|optical quality|color,,rock|sedimentary rock|limestone|chalk,,,precipitation process,,,,precipitation process,,
ENVO_00002055,sandstone,,,A sedimentary rock composed mainly of sand-size mineral or rock grains.,,,,,,,,ENVO_01000271,,hard,,,,,,,,hard,,,,,hard,,rock|sedimentary rock|sandstone|clastic sedimentary rock,,,,,,,,,
ENVO_00002056,shale,,,"A fine-grained sedimentary rock whose original constituents were clays or muds. It is characterized by thin laminae breaking with an irregular curving fracture, often splintery and usually parallel to the often-indistinguishable bedding plane.",,,,,,,,ENVO_01000271,,hard,,,,,,,,hard,,,,,hard,,rock|sedimentary rock|shale|clastic sedimentary rock,,,,,,,,,
ENVO_00002057,raw primary sludge,,,,,,,,,,,ENVO_00002044,,,,,,,,,anthropogenic environmental process,,,,,,,,sludge|raw primary sludge,,,anthropogenic environmental process,,,,anthropogenic environmental process,,
ENVO_00002058,secondary sludge,,,,,,,,,,,ENVO_00002044,,,,,,,,,anthropogenic environmental process,,,,,,,,sludge|secondary sludge,,,anthropogenic environmental process,,,,anthropogenic environmental process,,
ENVO_00002059,biosolids,,,"A treated form of sludge, sometimes used as a fertilizer in agriculture.",,,,,,,,ENVO_00002044,,,,,,,,,anthropogenic environmental process,,,,,,,,sludge|biosolids,,,anthropogenic environmental process,,,,anthropogenic environmental process,,
ENVO_00002060,oil sludge,,,"A solid or gel in motor oil caused by the oil gelling or solidifying, usually at temperatures lower than 100deg C.",,,,,,,,ENVO_00002176,,,,,,,,,anthropogenic environmental process,,,,,,,,oil sludge|sludge|contaminated sludge,,,anthropogenic environmental process,,,,anthropogenic environmental process,,
ENVO_00002113,deep marine sediment,,,"Sediment that accumulates in the flat or very gently sloping areas of the deep ocean basin floor. The three main types of deep marine sediment, also known as pelagic sediment, are siliceous oozes, calcareous oozes, and red clays.",,,deep marine sediments,,pelagic sediment {alternative name},,envoPolar,ENVO_03000033,marine water body,porous|granular|porosity,,,,,,,sedimentation in a water body|material accumulation process,porous|porosity|granular,,,,,porous|porosity|granular,,sediment|deep marine sediment|marine sediment,,marine water body,sedimentation in a water body|material accumulation process,,,,sedimentation in a water body|material accumulation process,,
ENVO_00002114,chemically enriched sediment,,,Sediment which has increased levels of one or more chemical compounds.,,,,,,,,ENVO_00002007,,porous|porosity|granular,,,,,,,,porous|porosity|granular,,,,,porous|porosity|granular,,sediment|chemically enriched sediment,,,,,,,,,
ENVO_00002115,petroleum enriched sediment,,,Organically enriched sediment which has increased levels of petroleum.,,,,,,,,ENVO_00002202,,porous|granular|porosity,,,,,,,,porous|porosity|granular,,,oil|petroleum,oil|petroleum,porous|porosity|granular,,sediment|organically enriched sediment|petroleum enriched sediment|chemically enriched sediment,,oil|petroleum,,oil|petroleum,,,,,
ENVO_00002116,contaminated soil,,"""contaminant"" is more of a disposition - any material entity can be a contaminant in particular circumstances.",A portion of contaminated soil is a portion of soil with elevated levels of some contaminant.,,,,,,,,ENVO_00003082,,porous|porosity,,,,,,,,porous|porosity,,,,clay|sand|silt,porous|porosity,,soil|enriched soil|contaminated soil,,pedosphere|clay|sand|silt,,pedosphere|clay|sand|silt,pedosphere,,,,
ENVO_00002117,creosote contaminated soil,,,Soil which has elevated concentrations of creosote.,,,,,,,,ENVO_00002116,,porous|porosity,,,,,,,,porous|porosity,,,manufactured product|chemical product|creosote,clay|sand|silt|manufactured product|chemical product|creosote,porous|porosity,,soil|enriched soil|contaminated soil|creosote contaminated soil,,pedosphere|sand|clay|silt|manufactured product|chemical product|creosote,,pedosphere|clay|sand|silt|manufactured product|chemical product|creosote,pedosphere,,,,
ENVO_00002118,sea sand,,,,,,,,,,,ENVO_01000017,,porous|porosity|granular,,,,,,,,porous|porosity|granular,,,,,granular,,sand|sea sand,,,,,,,,,
ENVO_00002122,arsenic-rich mud,,,Mud which has elevated concentrations of arsenic.,,,,,,,,ENVO_01000001,,,,,,,,,,,,,,soil|liquid water|clay|sand|silt,,,mud|arsenic-rich mud,,soil|pedosphere|sand|clay|liquid water|silt,,soil|pedosphere|clay|liquid water|sand|silt,,,,,
ENVO_00002127,stream sediment,,Revise adjacent to. Consider sampled stream sediment. Dry stream sediment.,,,,,,,,,ENVO_00002007,stream,porous|porosity|granular,,,,,,,,porous|porosity|granular,,,,,porous|porosity|granular,,sediment|stream sediment,,stream,,,,,,,
ENVO_00002129,anaerobic sludge,,,,,,,,,,,ENVO_00002044,,anaerobic|sensitivity toward|sensitivity to oxygen,,,,,,,anthropogenic environmental process,anaerobic|sensitivity toward|sensitivity to oxygen,,,,,anaerobic|sensitivity toward|sensitivity to oxygen,,sludge|anaerobic sludge,,,anthropogenic environmental process,,,,anthropogenic environmental process,,
ENVO_00002133,anaerobic mud,,,Mud which has no or neglible concentrations of dissolved oxygen.,,,anoxic mud,,,,,ENVO_01000001,,anaerobic|sensitivity toward|sensitivity to oxygen,,,,,,,,anaerobic|sensitivity toward|sensitivity to oxygen,,,,soil|liquid water|clay|sand|silt,anaerobic|sensitivity toward|sensitivity to oxygen,,mud|anaerobic mud,,soil|pedosphere|clay|sand|liquid water|silt,,soil|pedosphere|clay|liquid water|sand|silt,,,,,
ENVO_00002134,anaerobic stream sediment,,,,,,,,,,,ENVO_00002045; ENVO_00002127,stream,porous|granular|anaerobic|porosity|sensitivity toward|sensitivity to oxygen,,,,,,,,porous|porosity|granular|anaerobic|sensitivity toward|sensitivity to oxygen,,,,,porous|porosity|anaerobic|granular|sensitivity toward|sensitivity to oxygen,,sediment|anaerobic stream sediment|anaerobic sediment|stream sediment,,stream,,,,,,,
ENVO_00002135,treated wood,,,,,,,,,,,ENVO_00002040,,,,,,,,,,,,,,,,,wood|treated wood,,,,,,,,,
ENVO_00002136,arsenate treated wood,,,,,,,,,,,ENVO_00002135,,,,,,,,,,,,,arsenate(3-)|arsenic molecular entity|arsenate ion,arsenic molecular entity|arsenate(3-)|arsenate ion,,,wood|arsenate treated wood|treated wood,,arsenate(3-)|arsenic molecular entity|arsenate ion,,arsenate(3-)|arsenic molecular entity|arsenate ion,,,,,
ENVO_00002138,beach sand,,,,,,,,,,,ENVO_01000813; ENVO_01000017,,porous|porosity|granular,,,,,,,,porous|porosity|granular,,,,,granular,,sand|beach sand,,shore|beach|coast|sandy beach|landform|surface landform,,shore|beach|coast|sandy beach|landform|surface landform,shore|beach|coast|sandy beach|landform|surface landform,,,,
ENVO_00002141,leachate,,,"The liquid produced when water percolates through any permeable material. It can contain either dissolved or suspended material, or usually both.",,,,,,,,ENVO_00002006,,,,,,,,,,,,,,,,,liquid water|leachate,,,,,,,,,
ENVO_00002142,borax leachate,,,,,,,,,,,ENVO_00002141,,,,,,,,,,,,,,,,,liquid water|leachate|borax leachate,,,,,,,,,
ENVO_00002145,chromate contaminated soil,,,Soil which has elevated concentrations of chromate.,,,,,,,,ENVO_00003081,,porous|porosity,,,,,,,,porous|porosity,,,coordination entity|transition element coordination entity|chromate(2-)|chromium molecular entity|divalent inorganic anion|chromium coordination entity,clay|sand|silt|transition element coordination entity|coordination entity|metal allergen|chromate(2-)|chromium molecular entity|divalent inorganic anion|chromium coordination entity,porous|porosity,,soil|enriched soil|metal contaminated soil|chromate contaminated soil|contaminated soil,,pedosphere|clay|sand|silt|coordination entity|transition element coordination entity|metal allergen|chromate(2-)|chromium molecular entity|divalent inorganic anion|chromium coordination entity,,pedosphere|clay|sand|silt|coordination entity|transition element coordination entity|metal allergen|chromate(2-)|chromium molecular entity|divalent inorganic anion|chromium coordination entity,pedosphere,,,,
